{"review_id":"REVIEW-1","scope_type":"CAPABILITY_UNIT","scope_id":"CU-USER","stage_type":"CODING","baseline_candidate_ref":"CANDIDATE-1","artifact_hashes":["sha256:aaaaaaaaaaaaaaaaaaaaaaaaaaaaaaaaaaaaaaaaaaaaaaaaaaaaaaaaaaaaaaaa"],"reviewer_identity":"USER-REVIEWER","reviewer_role":"REVIEWER","primary_executor_id":"USER-CODER","separation_policy":"ENFORCED","decision":"APPROVED","comments":"证据完整","reviewed_at":"2026-08-05T12:00:00Z","idempotency_key":"IDEMPOTENCY-1"}
